{
  "schema_version": "0.1.0",
  "adjudication_record_id": "ADJ-TEST-001",
  "blinded_item_id": "BITEM-aaaaaaaaaaaaaaaa",
  "source_score_record_ids": [
    "SCORE-TEST-001",
    "SCORE-TEST-004"
  ],
  "disagreement_summary": "Q4 differed: rater_alpha=2, rater_beta=1",
  "adjudicated_scores": {
    "Q1": 2,
    "Q2": 2,
    "Q3": 2,
    "Q4": 2,
    "Q5": 2
  },
  "adjudicated_terminal_state": "APPROPRIATE_ADVANCE",
  "adjudicator_id": "adjudicator_gamma",
  "rationale": "Response is concise and does not contain ceremonial overhead. Q4=2 upheld.",
  "timestamp": "2026-08-31T11:00:00Z"
}